[
  {
    "group_id": "GRP_001",
    "group_name": "Historic Recording Ensemble 1",
    "formation_calendar_year": 1960,
    "disbandment_year": 1980,
    "ensemble_structure_type": "Quartet",
    "origin_city": "Los Angeles",
    "origin_country": "US",
    "current_activity_status": false,
    "signature_musical_style": "Harmonic Vocal Pop and Rock",
    "musicbrainz_group_gid": "61523cf3d1e8723aa7665876002c1122"
  },
  {
    "group_id": "GRP_002",
    "group_name": "Historic Recording Ensemble 2",
    "formation_calendar_year": 1961,
    "disbandment_year": 2026,
    "ensemble_structure_type": "Trio",
    "origin_city": "London",
    "origin_country": "UK",
    "current_activity_status": true,
    "signature_musical_style": "Harmonic Vocal Pop and Rock",
    "musicbrainz_group_gid": "6dd96f5f51d898b5f02b2b9de0b33a76"
  },
  {
    "group_id": "GRP_003",
    "group_name": "Historic Recording Ensemble 3",
    "formation_calendar_year": 1962,
    "disbandment_year": 2026,
    "ensemble_structure_type": "Quartet",
    "origin_city": "Los Angeles",
    "origin_country": "US",
    "current_activity_status": true,
    "signature_musical_style": "Harmonic Vocal Pop and Rock",
    "musicbrainz_group_gid": "4f66a76373c2be5f5f13947cc1e94ae0"
  },
  {
    "group_id": "GRP_004",
    "group_name": "Historic Recording Ensemble 4",
    "formation_calendar_year": 1963,
    "disbandment_year": 1983,
    "ensemble_structure_type": "Trio",
    "origin_city": "London",
    "origin_country": "UK",
    "current_activity_status": false,
    "signature_musical_style": "Harmonic Vocal Pop and Rock",
    "musicbrainz_group_gid": "327616dbfd5c7b0b162c1b328cc5aee7"
  },
  {
    "group_id": "GRP_005",
    "group_name": "Historic Recording Ensemble 5",
    "formation_calendar_year": 1964,
    "disbandment_year": 2026,
    "ensemble_structure_type": "Quartet",
    "origin_city": "Los Angeles",
    "origin_country": "US",
    "current_activity_status": true,
    "signature_musical_style": "Harmonic Vocal Pop and Rock",
    "musicbrainz_group_gid": "8e382e12a2d95f87325d933b271f5c53"
  },
  {
    "group_id": "GRP_006",
    "group_name": "Historic Recording Ensemble 6",
    "formation_calendar_year": 1965,
    "disbandment_year": 2026,
    "ensemble_structure_type": "Trio",
    "origin_city": "London",
    "origin_country": "UK",
    "current_activity_status": true,
    "signature_musical_style": "Harmonic Vocal Pop and Rock",
    "musicbrainz_group_gid": "36fdefa88e9c2f466a2205d2e6e94808"
  },
  {
    "group_id": "GRP_007",
    "group_name": "Historic Recording Ensemble 7",
    "formation_calendar_year": 1966,
    "disbandment_year": 1986,
    "ensemble_structure_type": "Quartet",
    "origin_city": "Los Angeles",
    "origin_country": "US",
    "current_activity_status": false,
    "signature_musical_style": "Harmonic Vocal Pop and Rock",
    "musicbrainz_group_gid": "5819ce94ba377edc39dd7ed957352b1b"
  },
  {
    "group_id": "GRP_008",
    "group_name": "Historic Recording Ensemble 8",
    "formation_calendar_year": 1967,
    "disbandment_year": 2026,
    "ensemble_structure_type": "Trio",
    "origin_city": "London",
    "origin_country": "UK",
    "current_activity_status": true,
    "signature_musical_style": "Harmonic Vocal Pop and Rock",
    "musicbrainz_group_gid": "ea0363e4ead5ba3071327896b8957277"
  },
  {
    "group_id": "GRP_009",
    "group_name": "Historic Recording Ensemble 9",
    "formation_calendar_year": 1968,
    "disbandment_year": 2026,
    "ensemble_structure_type": "Quartet",
    "origin_city": "Los Angeles",
    "origin_country": "US",
    "current_activity_status": true,
    "signature_musical_style": "Harmonic Vocal Pop and Rock",
    "musicbrainz_group_gid": "c25a4b74d31d3ee8a8a5aed1d15122c7"
  },
  {
    "group_id": "GRP_010",
    "group_name": "Historic Recording Ensemble 10",
    "formation_calendar_year": 1969,
    "disbandment_year": 1989,
    "ensemble_structure_type": "Trio",
    "origin_city": "London",
    "origin_country": "UK",
    "current_activity_status": false,
    "signature_musical_style": "Harmonic Vocal Pop and Rock",
    "musicbrainz_group_gid": "7a8da8e5a0b0569aa90dfd787df22e15"
  },
  {
    "group_id": "GRP_011",
    "group_name": "Historic Recording Ensemble 11",
    "formation_calendar_year": 1970,
    "disbandment_year": 2026,
    "ensemble_structure_type": "Quartet",
    "origin_city": "Los Angeles",
    "origin_country": "US",
    "current_activity_status": true,
    "signature_musical_style": "Harmonic Vocal Pop and Rock",
    "musicbrainz_group_gid": "3bdb4cf815c04891fc7be418d09e9857"
  },
  {
    "group_id": "GRP_012",
    "group_name": "Historic Recording Ensemble 12",
    "formation_calendar_year": 1971,
    "disbandment_year": 2026,
    "ensemble_structure_type": "Trio",
    "origin_city": "London",
    "origin_country": "UK",
    "current_activity_status": true,
    "signature_musical_style": "Harmonic Vocal Pop and Rock",
    "musicbrainz_group_gid": "f5c821bd6ad40848869c870e78fc8535"
  },
  {
    "group_id": "GRP_013",
    "group_name": "Historic Recording Ensemble 13",
    "formation_calendar_year": 1972,
    "disbandment_year": 1992,
    "ensemble_structure_type": "Quartet",
    "origin_city": "Los Angeles",
    "origin_country": "US",
    "current_activity_status": false,
    "signature_musical_style": "Harmonic Vocal Pop and Rock",
    "musicbrainz_group_gid": "1ff4efdfd7334ffa2f84079c93ddb896"
  },
  {
    "group_id": "GRP_014",
    "group_name": "Historic Recording Ensemble 14",
    "formation_calendar_year": 1973,
    "disbandment_year": 2026,
    "ensemble_structure_type": "Trio",
    "origin_city": "London",
    "origin_country": "UK",
    "current_activity_status": true,
    "signature_musical_style": "Harmonic Vocal Pop and Rock",
    "musicbrainz_group_gid": "309f9e6dc6e7bcae49d13af8f54829e0"
  },
  {
    "group_id": "GRP_015",
    "group_name": "Historic Recording Ensemble 15",
    "formation_calendar_year": 1974,
    "disbandment_year": 2026,
    "ensemble_structure_type": "Quartet",
    "origin_city": "Los Angeles",
    "origin_country": "US",
    "current_activity_status": true,
    "signature_musical_style": "Harmonic Vocal Pop and Rock",
    "musicbrainz_group_gid": "636e4abb8587c0d786a9932d32ae7469"
  },
  {
    "group_id": "GRP_016",
    "group_name": "Historic Recording Ensemble 16",
    "formation_calendar_year": 1975,
    "disbandment_year": 1995,
    "ensemble_structure_type": "Trio",
    "origin_city": "London",
    "origin_country": "UK",
    "current_activity_status": false,
    "signature_musical_style": "Harmonic Vocal Pop and Rock",
    "musicbrainz_group_gid": "62d1c827cdef1645471ffb5c8eacb733"
  },
  {
    "group_id": "GRP_017",
    "group_name": "Historic Recording Ensemble 17",
    "formation_calendar_year": 1976,
    "disbandment_year": 2026,
    "ensemble_structure_type": "Quartet",
    "origin_city": "Los Angeles",
    "origin_country": "US",
    "current_activity_status": true,
    "signature_musical_style": "Harmonic Vocal Pop and Rock",
    "musicbrainz_group_gid": "7f6a9934ac70463b5c2fbdb5d23a1160"
  },
  {
    "group_id": "GRP_018",
    "group_name": "Historic Recording Ensemble 18",
    "formation_calendar_year": 1977,
    "disbandment_year": 2026,
    "ensemble_structure_type": "Trio",
    "origin_city": "London",
    "origin_country": "UK",
    "current_activity_status": true,
    "signature_musical_style": "Harmonic Vocal Pop and Rock",
    "musicbrainz_group_gid": "680baf1174cedf53f4c95c09956ac8b0"
  },
  {
    "group_id": "GRP_019",
    "group_name": "Historic Recording Ensemble 19",
    "formation_calendar_year": 1978,
    "disbandment_year": 1998,
    "ensemble_structure_type": "Quartet",
    "origin_city": "Los Angeles",
    "origin_country": "US",
    "current_activity_status": false,
    "signature_musical_style": "Harmonic Vocal Pop and Rock",
    "musicbrainz_group_gid": "84765f861f77242a4e5632402d08c759"
  },
  {
    "group_id": "GRP_020",
    "group_name": "Historic Recording Ensemble 20",
    "formation_calendar_year": 1979,
    "disbandment_year": 2026,
    "ensemble_structure_type": "Trio",
    "origin_city": "London",
    "origin_country": "UK",
    "current_activity_status": true,
    "signature_musical_style": "Harmonic Vocal Pop and Rock",
    "musicbrainz_group_gid": "45b716af004f3ba398c6b4280d82db9d"
  },
  {
    "group_id": "GRP_021",
    "group_name": "Historic Recording Ensemble 21",
    "formation_calendar_year": 1980,
    "disbandment_year": 2026,
    "ensemble_structure_type": "Quartet",
    "origin_city": "Los Angeles",
    "origin_country": "US",
    "current_activity_status": true,
    "signature_musical_style": "Harmonic Vocal Pop and Rock",
    "musicbrainz_group_gid": "df0d7c4a9fe2d71fe5774a0d3f0abcbc"
  },
  {
    "group_id": "GRP_022",
    "group_name": "Historic Recording Ensemble 22",
    "formation_calendar_year": 1981,
    "disbandment_year": 2001,
    "ensemble_structure_type": "Trio",
    "origin_city": "London",
    "origin_country": "UK",
    "current_activity_status": false,
    "signature_musical_style": "Harmonic Vocal Pop and Rock",
    "musicbrainz_group_gid": "7bf15f7d99148da7ceb0b9eb713edc3a"
  },
  {
    "group_id": "GRP_023",
    "group_name": "Historic Recording Ensemble 23",
    "formation_calendar_year": 1982,
    "disbandment_year": 2026,
    "ensemble_structure_type": "Quartet",
    "origin_city": "Los Angeles",
    "origin_country": "US",
    "current_activity_status": true,
    "signature_musical_style": "Harmonic Vocal Pop and Rock",
    "musicbrainz_group_gid": "8d2a26fcdd24c97a001cf50e4973ae45"
  },
  {
    "group_id": "GRP_024",
    "group_name": "Historic Recording Ensemble 24",
    "formation_calendar_year": 1983,
    "disbandment_year": 2026,
    "ensemble_structure_type": "Trio",
    "origin_city": "London",
    "origin_country": "UK",
    "current_activity_status": true,
    "signature_musical_style": "Harmonic Vocal Pop and Rock",